{
  "schema_version": "c2/2.0.0",
  "id": "cb4c2c39de0689063",
  "fingerprint": "b4c2c39de0689063fc7a6c9a7640a9a3f26d56eee98af88d898c5b6b491ce049",
  "class": "atomicity-triple",
  "pattern": "RWR",
  "subject": {
    "name": "svp_simple_029_001",
    "source_root": "C:\\Users\\luoma\\Desktop\\racebench\\2.1_remarks"
  },
  "variable": {
    "name": "svp_simple_029_001_tm_blocks",
    "declared_type": "volatile unsigned8[]",
    "volatile": true,
    "decl": {
      "file": "svp_simple_029/svp_simple_029_001.c",
      "line": 19,
      "column": 0,
      "end_line": 19,
      "snippet": "volatile unsigned8 svp_simple_029_001_tm_blocks[4096];"
    },
    "storage": "global",
    "aliases": [],
    "svf_node": null
  },
  "accesses": [
    {
      "role": "A1",
      "kind": "read",
      "flow": "main",
      "function": "svp_simple_029_001_GetTmData",
      "source": {
        "file": "svp_simple_029/svp_simple_029_001.c",
        "line": 80,
        "column": 2,
        "end_line": 80,
        "snippet": "return svp_simple_029_001_tm_blocks[tm_name];"
      },
      "loop_context": {
        "in_loop": false,
        "nest": []
      },
      "call_path": {
        "flow": "main",
        "frames": [
          {
            "function": "svp_simple_029_001_main",
            "call_site": {
              "file": "svp_simple_029/svp_simple_029_001.c",
              "line": 40
            }
          },
          {
            "function": "svp_simple_029_001_SetSelfCtrlFlag",
            "call_site": {
              "file": "svp_simple_029/svp_simple_029_001.c",
              "line": 73
            },
            "resolution": "indirect-resolved"
          },
          {
            "function": "svp_simple_029_001_GetTmData"
          }
        ]
      },
      "masking": {
        "disabled": [],
        "enabled": [
          1
        ],
        "unknown": []
      }
    },
    {
      "role": "B",
      "kind": "write",
      "flow": "isr_1",
      "function": "svp_simple_029_001_SetTmData",
      "source": {
        "file": "svp_simple_029/svp_simple_029_001.c",
        "line": 83,
        "column": 2,
        "end_line": 83,
        "snippet": "svp_simple_029_001_tm_blocks[tm_name] = tm_data;"
      },
      "loop_context": {
        "in_loop": false,
        "nest": []
      },
      "call_path": {
        "flow": "isr_1",
        "frames": [
          {
            "function": "svp_simple_029_001_isr_1",
            "call_site": {
              "file": "svp_simple_029/svp_simple_029_001.c",
              "line": 89
            },
            "resolution": "indirect-resolved"
          },
          {
            "function": "svp_simple_029_001_SetTmData"
          }
        ]
      },
      "masking": {
        "disabled": [],
        "enabled": [
          1
        ],
        "unknown": []
      }
    },
    {
      "role": "A2",
      "kind": "read",
      "flow": "main",
      "function": "svp_simple_029_001_GetTmData",
      "source": {
        "file": "svp_simple_029/svp_simple_029_001.c",
        "line": 80,
        "column": 2,
        "end_line": 80,
        "snippet": "return svp_simple_029_001_tm_blocks[tm_name];"
      },
      "loop_context": {
        "in_loop": false,
        "nest": []
      },
      "call_path": {
        "flow": "main",
        "frames": [
          {
            "function": "svp_simple_029_001_main",
            "call_site": {
              "file": "svp_simple_029/svp_simple_029_001.c",
              "line": 40
            }
          },
          {
            "function": "svp_simple_029_001_SetSelfCtrlFlag",
            "call_site": {
              "file": "svp_simple_029/svp_simple_029_001.c",
              "line": 74
            },
            "resolution": "indirect-resolved"
          },
          {
            "function": "svp_simple_029_001_GetTmData"
          }
        ]
      },
      "masking": {
        "disabled": [],
        "enabled": [
          1
        ],
        "unknown": []
      }
    }
  ],
  "flows": [
    {
      "id": "main",
      "kind": "task",
      "entry": "svp_simple_029_001_main",
      "irq": null,
      "priority": 0,
      "identified_by": "config"
    },
    {
      "id": "isr_1",
      "kind": "isr",
      "entry": "svp_simple_029_001_isr_1",
      "irq": 1,
      "priority": 1,
      "identified_by": "config"
    }
  ],
  "preemption": {
    "preempting_flow": "isr_1",
    "preempted_flow": "main",
    "priority_relation": "strictly-higher",
    "equal_priority_assumed_preemptible": null,
    "nesting_depth": 1,
    "timing": "unconstrained"
  },
  "masking": {
    "per_access": [
      {
        "role": "A1",
        "state": {
          "disabled": [],
          "enabled": [
            1
          ],
          "unknown": []
        }
      },
      {
        "role": "B",
        "state": {
          "disabled": [],
          "enabled": [
            1
          ],
          "unknown": []
        }
      },
      {
        "role": "A2",
        "state": {
          "disabled": [],
          "enabled": [
            1
          ],
          "unknown": []
        }
      }
    ],
    "interval": {
      "from_role": "A1",
      "to_role": "A2",
      "disabled_throughout": [],
      "enabled_somewhere": [
        1
      ],
      "unknown": [],
      "reenabled_within_interval_by": [],
      "critical_sections": []
    }
  },
  "call_paths": [
    {
      "role": "A1",
      "path": {
        "flow": "main",
        "frames": [
          {
            "function": "svp_simple_029_001_main",
            "call_site": {
              "file": "svp_simple_029/svp_simple_029_001.c",
              "line": 40
            }
          },
          {
            "function": "svp_simple_029_001_SetSelfCtrlFlag",
            "call_site": {
              "file": "svp_simple_029/svp_simple_029_001.c",
              "line": 73
            },
            "resolution": "indirect-resolved"
          },
          {
            "function": "svp_simple_029_001_GetTmData"
          }
        ]
      }
    },
    {
      "role": "B",
      "path": {
        "flow": "isr_1",
        "frames": [
          {
            "function": "svp_simple_029_001_isr_1",
            "call_site": {
              "file": "svp_simple_029/svp_simple_029_001.c",
              "line": 89
            },
            "resolution": "indirect-resolved"
          },
          {
            "function": "svp_simple_029_001_SetTmData"
          }
        ]
      }
    },
    {
      "role": "A2",
      "path": {
        "flow": "main",
        "frames": [
          {
            "function": "svp_simple_029_001_main",
            "call_site": {
              "file": "svp_simple_029/svp_simple_029_001.c",
              "line": 40
            }
          },
          {
            "function": "svp_simple_029_001_SetSelfCtrlFlag",
            "call_site": {
              "file": "svp_simple_029/svp_simple_029_001.c",
              "line": 74
            },
            "resolution": "indirect-resolved"
          },
          {
            "function": "svp_simple_029_001_GetTmData"
          }
        ]
      }
    }
  ],
  "loop_context": {
    "per_access": [
      {
        "role": "A1",
        "context": {
          "in_loop": false,
          "nest": []
        }
      },
      {
        "role": "B",
        "context": {
          "in_loop": false,
          "nest": []
        }
      },
      {
        "role": "A2",
        "context": {
          "in_loop": false,
          "nest": []
        }
      }
    ],
    "a1_a2_same_statement": true
  },
  "enclosing_source": [
    {
      "function": "svp_simple_029_001_GetTmData",
      "file": "svp_simple_029/svp_simple_029_001.c",
      "line_start": 79,
      "line_end": 81,
      "code": "unsigned8 svp_simple_029_001_GetTmData(unsigned32 tm_name) {\n  return svp_simple_029_001_tm_blocks[tm_name]; \n}",
      "truncated": false
    },
    {
      "function": "svp_simple_029_001_SetTmData",
      "file": "svp_simple_029/svp_simple_029_001.c",
      "line_start": 82,
      "line_end": 84,
      "code": "void svp_simple_029_001_SetTmData(unsigned32 tm_name, unsigned8 tm_data) {\n  svp_simple_029_001_tm_blocks[tm_name] = tm_data; \n}",
      "truncated": false
    }
  ],
  "solver_result": {
    "verdict": "not_run",
    "engine": "z3"
  },
  "static_features": {
    "feeds_branch": false,
    "used_as_index": true,
    "call_path_depth_max": 3,
    "same_statement_a1_a2": true,
    "priority_gap": 1,
    "any_masking_present": false
  },
  "provenance": {
    "entries": [
      {
        "fact": "flows",
        "status": "assumed_from_config",
        "note": "entry points, interrupt numbers and priorities come from the suite README table, which also states the convention that a larger number is a higher priority"
      },
      {
        "fact": "solver_result",
        "status": "unknown",
        "note": "stage 3 has not run; this is a stage-2 record"
      },
      {
        "fact": "call_paths",
        "status": "proven",
        "note": "line 73 calls GetTmData(tm_para) and line 74 calls GetTmData(tm_para + 1); main invokes SetSelfCtrlFlag with tm_para = 36, so the two reads at line 80 are of elements 36 and 37 respectively"
      }
    ],
    "completeness": {
      "unresolved_indirect_calls": 0,
      "opaque_external_calls": [
        "init",
        "idlerun"
      ],
      "truncated_fields": []
    }
  },
  "emitted_by": {
    "tool_version": "0.1.0",
    "stage": "stage2",
    "run_id": "svp_simple_029_001-fixture",
    "timestamp": "2026-09-26T00:00:00Z"
  }
}
