{
  "schema_version": "c2/2.0.0",
  "id": "c1a015d2f1d307ead",
  "fingerprint": "1a015d2f1d307ead6af0fcbeb1a04929c789c084fbd012950996f9d5df072289",
  "class": "atomicity-triple",
  "pattern": "WWR",
  "subject": {
    "name": "svp_simple_002_001",
    "source_root": "C:\\Users\\luoma\\Desktop\\racebench\\2.1_remarks"
  },
  "variable": {
    "name": "svp_simple_002_001_global_array",
    "declared_type": "volatile int[]",
    "volatile": true,
    "decl": {
      "file": "svp_simple_002/svp_simple_002_001.c",
      "line": 22,
      "column": 0,
      "end_line": 22,
      "snippet": "volatile int svp_simple_002_001_global_array[MAX_LENGTH];"
    },
    "storage": "global",
    "aliases": [],
    "svf_node": null
  },
  "accesses": [
    {
      "role": "A1",
      "kind": "write",
      "flow": "isr_1",
      "function": "svp_simple_002_001_isr_1",
      "source": {
        "file": "svp_simple_002/svp_simple_002_001.c",
        "line": 33,
        "column": 4,
        "end_line": 33,
        "snippet": "if (i == TRIGGER) svp_simple_002_001_global_array[TRIGGER] = 1;"
      },
      "loop_context": {
        "in_loop": true,
        "nest": [
          {
            "header": {
              "file": "svp_simple_002/svp_simple_002_001.c",
              "line": 32,
              "column": 2,
              "snippet": "for (int i = 0; i < MAX_LENGTH; i++) {"
            }
          }
        ]
      },
      "call_path": {
        "flow": "isr_1",
        "frames": [
          {
            "function": "svp_simple_002_001_isr_1"
          }
        ]
      },
      "masking": {
        "disabled": [],
        "enabled": [
          1,
          2
        ],
        "unknown": []
      }
    },
    {
      "role": "B",
      "kind": "write",
      "flow": "isr_2",
      "function": "svp_simple_002_001_isr_2",
      "source": {
        "file": "svp_simple_002/svp_simple_002_001.c",
        "line": 44,
        "column": 2,
        "end_line": 44,
        "snippet": "svp_simple_002_001_global_array[TRIGGER] = 999;"
      },
      "loop_context": {
        "in_loop": false,
        "nest": []
      },
      "call_path": {
        "flow": "isr_2",
        "frames": [
          {
            "function": "svp_simple_002_001_isr_2"
          }
        ]
      },
      "masking": {
        "disabled": [],
        "enabled": [
          1,
          2
        ],
        "unknown": []
      }
    },
    {
      "role": "A2",
      "kind": "read",
      "flow": "isr_1",
      "function": "svp_simple_002_001_isr_1",
      "source": {
        "file": "svp_simple_002/svp_simple_002_001.c",
        "line": 37,
        "column": 2,
        "end_line": 37,
        "snippet": "mininum = svp_simple_002_001_global_array[TRIGGER] - 10;"
      },
      "loop_context": {
        "in_loop": false,
        "nest": []
      },
      "call_path": {
        "flow": "isr_1",
        "frames": [
          {
            "function": "svp_simple_002_001_isr_1"
          }
        ]
      },
      "masking": {
        "disabled": [],
        "enabled": [
          1,
          2
        ],
        "unknown": []
      }
    }
  ],
  "flows": [
    {
      "id": "isr_1",
      "kind": "isr",
      "entry": "svp_simple_002_001_isr_1",
      "irq": 1,
      "priority": 1,
      "identified_by": "config"
    },
    {
      "id": "isr_2",
      "kind": "isr",
      "entry": "svp_simple_002_001_isr_2",
      "irq": 2,
      "priority": 2,
      "identified_by": "config"
    }
  ],
  "preemption": {
    "preempting_flow": "isr_2",
    "preempted_flow": "isr_1",
    "priority_relation": "strictly-higher",
    "equal_priority_assumed_preemptible": null,
    "nesting_depth": 2,
    "timing": "unconstrained"
  },
  "masking": {
    "per_access": [
      {
        "role": "A1",
        "state": {
          "disabled": [],
          "enabled": [
            1,
            2
          ],
          "unknown": []
        }
      },
      {
        "role": "B",
        "state": {
          "disabled": [],
          "enabled": [
            1,
            2
          ],
          "unknown": []
        }
      },
      {
        "role": "A2",
        "state": {
          "disabled": [],
          "enabled": [
            1,
            2
          ],
          "unknown": []
        }
      }
    ],
    "interval": {
      "from_role": "A1",
      "to_role": "A2",
      "disabled_throughout": [],
      "enabled_somewhere": [
        1,
        2
      ],
      "unknown": [],
      "reenabled_within_interval_by": [],
      "critical_sections": []
    }
  },
  "call_paths": [
    {
      "role": "A1",
      "path": {
        "flow": "isr_1",
        "frames": [
          {
            "function": "svp_simple_002_001_isr_1"
          }
        ]
      }
    },
    {
      "role": "B",
      "path": {
        "flow": "isr_2",
        "frames": [
          {
            "function": "svp_simple_002_001_isr_2"
          }
        ]
      }
    },
    {
      "role": "A2",
      "path": {
        "flow": "isr_1",
        "frames": [
          {
            "function": "svp_simple_002_001_isr_1"
          }
        ]
      }
    }
  ],
  "loop_context": {
    "per_access": [
      {
        "role": "A1",
        "context": {
          "in_loop": true,
          "nest": [
            {
              "header": {
                "file": "svp_simple_002/svp_simple_002_001.c",
                "line": 32,
                "column": 2,
                "snippet": "for (int i = 0; i < MAX_LENGTH; i++) {"
              }
            }
          ]
        }
      },
      {
        "role": "B",
        "context": {
          "in_loop": false,
          "nest": []
        }
      },
      {
        "role": "A2",
        "context": {
          "in_loop": false,
          "nest": []
        }
      }
    ],
    "a1_a2_same_statement": false
  },
  "enclosing_source": [
    {
      "function": "svp_simple_002_001_isr_1",
      "file": "svp_simple_002/svp_simple_002_001.c",
      "line_start": 30,
      "line_end": 40,
      "code": "void svp_simple_002_001_isr_1() {\n  int mininum, maxnum;\n  for (int i = 0; i < MAX_LENGTH; i++) {\n    if (i == TRIGGER) svp_simple_002_001_global_array[TRIGGER] = 1;\n    if (i == MAX_LENGTH + 1)\n      svp_simple_002_001_global_array[TRIGGER] = 1;\n  }\n  mininum = svp_simple_002_001_global_array[TRIGGER] - 10;\n\n  maxnum = svp_simple_002_001_global_array[0] + 10;\n}",
      "truncated": false
    },
    {
      "function": "svp_simple_002_001_isr_2",
      "file": "svp_simple_002/svp_simple_002_001.c",
      "line_start": 42,
      "line_end": 46,
      "code": "void svp_simple_002_001_isr_2() {\n  idlerun();\n  svp_simple_002_001_global_array[TRIGGER] = 999;\n\n}",
      "truncated": false
    }
  ],
  "solver_result": {
    "verdict": "not_run",
    "engine": "z3"
  },
  "static_features": {
    "feeds_branch": false,
    "used_as_index": false,
    "call_path_depth_max": 1,
    "same_statement_a1_a2": false,
    "priority_gap": 1,
    "any_masking_present": false
  },
  "provenance": {
    "entries": [
      {
        "fact": "flows",
        "status": "assumed_from_config",
        "note": "entry points, interrupt numbers and priorities come from the suite README table, which also states the convention that a larger number is a higher priority"
      },
      {
        "fact": "solver_result",
        "status": "unknown",
        "note": "stage 3 has not run; this is a stage-2 record"
      },
      {
        "fact": "masking.per_access",
        "status": "unknown",
        "note": "whether an ISR's own interrupt line is masked for the duration of the handler is not specified by the suite and is not modelled here; only explicit disable_isr/enable_isr calls are treated as established"
      },
      {
        "fact": "preemption",
        "status": "proven",
        "note": "isr_2 has priority 2 and isr_1 priority 1; by the README's stated convention a larger number is higher, so isr_2 may preempt isr_1. The case contains no disable_isr call."
      }
    ],
    "completeness": {
      "unresolved_indirect_calls": 0,
      "opaque_external_calls": [
        "init",
        "idlerun"
      ],
      "truncated_fields": []
    }
  },
  "emitted_by": {
    "tool_version": "0.1.0",
    "stage": "stage2",
    "run_id": "svp_simple_002_001-fixture",
    "timestamp": "2026-09-26T00:00:00Z"
  }
}
