{
  "schema_version": "c2/2.0.0",
  "id": "c6756411eeb134a3c",
  "fingerprint": "6756411eeb134a3c3b3124e0d746b4c1c07ba7f21c33f5feeafddad2d1ffdb82",
  "class": "atomicity-triple",
  "pattern": "WRW",
  "subject": {
    "name": "svp_simple_005_001",
    "source_root": "C:\\Users\\luoma\\Desktop\\racebench\\2.1_remarks"
  },
  "variable": {
    "name": "svp_simple_005_001_global_var",
    "declared_type": "volatile int",
    "volatile": true,
    "decl": {
      "file": "svp_simple_005/svp_simple_005_001.c",
      "line": 25,
      "column": 0,
      "end_line": 25,
      "snippet": "volatile int svp_simple_005_001_global_var;"
    },
    "storage": "global",
    "aliases": [],
    "svf_node": null
  },
  "accesses": [
    {
      "role": "A1",
      "kind": "write",
      "flow": "main",
      "function": "svp_simple_005_001_main",
      "source": {
        "file": "svp_simple_005/svp_simple_005_001.c",
        "line": 32,
        "column": 8,
        "end_line": 32,
        "snippet": "svp_simple_005_001_global_var = 0x01;"
      },
      "loop_context": {
        "in_loop": true,
        "nest": [
          {
            "header": {
              "file": "svp_simple_005/svp_simple_005_001.c",
              "line": 30,
              "column": 4,
              "snippet": "for (int j = 0; j < MAX_LENGTH; j++) {"
            }
          },
          {
            "header": {
              "file": "svp_simple_005/svp_simple_005_001.c",
              "line": 29,
              "column": 2,
              "snippet": "for (int i = 0; i < MAX_LENGTH; i++) {"
            }
          }
        ]
      },
      "call_path": {
        "flow": "main",
        "frames": [
          {
            "function": "svp_simple_005_001_main"
          }
        ]
      },
      "masking": {
        "disabled": [],
        "enabled": [
          1
        ],
        "unknown": []
      }
    },
    {
      "role": "B",
      "kind": "read",
      "flow": "isr_1",
      "function": "svp_simple_005_001_isr_1",
      "source": {
        "file": "svp_simple_005/svp_simple_005_001.c",
        "line": 46,
        "column": 2,
        "end_line": 46,
        "snippet": "reader = svp_simple_005_001_global_var;"
      },
      "loop_context": {
        "in_loop": false,
        "nest": []
      },
      "call_path": {
        "flow": "isr_1",
        "frames": [
          {
            "function": "svp_simple_005_001_isr_1"
          }
        ]
      },
      "masking": {
        "disabled": [],
        "enabled": [
          1
        ],
        "unknown": []
      }
    },
    {
      "role": "A2",
      "kind": "write",
      "flow": "main",
      "function": "svp_simple_005_001_main",
      "source": {
        "file": "svp_simple_005/svp_simple_005_001.c",
        "line": 40,
        "column": 2,
        "end_line": 40,
        "snippet": "svp_simple_005_001_global_var = 0x05;"
      },
      "loop_context": {
        "in_loop": false,
        "nest": []
      },
      "call_path": {
        "flow": "main",
        "frames": [
          {
            "function": "svp_simple_005_001_main"
          }
        ]
      },
      "masking": {
        "disabled": [],
        "enabled": [
          1
        ],
        "unknown": []
      }
    }
  ],
  "flows": [
    {
      "id": "main",
      "kind": "task",
      "entry": "svp_simple_005_001_main",
      "irq": null,
      "priority": 0,
      "identified_by": "config"
    },
    {
      "id": "isr_1",
      "kind": "isr",
      "entry": "svp_simple_005_001_isr_1",
      "irq": 1,
      "priority": 1,
      "identified_by": "config"
    }
  ],
  "preemption": {
    "preempting_flow": "isr_1",
    "preempted_flow": "main",
    "priority_relation": "strictly-higher",
    "equal_priority_assumed_preemptible": null,
    "nesting_depth": 1,
    "timing": "unconstrained"
  },
  "masking": {
    "per_access": [
      {
        "role": "A1",
        "state": {
          "disabled": [],
          "enabled": [
            1
          ],
          "unknown": []
        }
      },
      {
        "role": "B",
        "state": {
          "disabled": [],
          "enabled": [
            1
          ],
          "unknown": []
        }
      },
      {
        "role": "A2",
        "state": {
          "disabled": [],
          "enabled": [
            1
          ],
          "unknown": []
        }
      }
    ],
    "interval": {
      "from_role": "A1",
      "to_role": "A2",
      "disabled_throughout": [],
      "enabled_somewhere": [
        1
      ],
      "unknown": [],
      "reenabled_within_interval_by": [],
      "critical_sections": []
    }
  },
  "call_paths": [
    {
      "role": "A1",
      "path": {
        "flow": "main",
        "frames": [
          {
            "function": "svp_simple_005_001_main"
          }
        ]
      }
    },
    {
      "role": "B",
      "path": {
        "flow": "isr_1",
        "frames": [
          {
            "function": "svp_simple_005_001_isr_1"
          }
        ]
      }
    },
    {
      "role": "A2",
      "path": {
        "flow": "main",
        "frames": [
          {
            "function": "svp_simple_005_001_main"
          }
        ]
      }
    }
  ],
  "loop_context": {
    "per_access": [
      {
        "role": "A1",
        "context": {
          "in_loop": true,
          "nest": [
            {
              "header": {
                "file": "svp_simple_005/svp_simple_005_001.c",
                "line": 30,
                "column": 4,
                "snippet": "for (int j = 0; j < MAX_LENGTH; j++) {"
              }
            },
            {
              "header": {
                "file": "svp_simple_005/svp_simple_005_001.c",
                "line": 29,
                "column": 2,
                "snippet": "for (int i = 0; i < MAX_LENGTH; i++) {"
              }
            }
          ]
        }
      },
      {
        "role": "B",
        "context": {
          "in_loop": false,
          "nest": []
        }
      },
      {
        "role": "A2",
        "context": {
          "in_loop": false,
          "nest": []
        }
      }
    ],
    "a1_a2_same_statement": false
  },
  "enclosing_source": [
    {
      "function": "svp_simple_005_001_main",
      "file": "svp_simple_005/svp_simple_005_001.c",
      "line_start": 27,
      "line_end": 41,
      "code": "void svp_simple_005_001_main() {\n  init();\n  for (int i = 0; i < MAX_LENGTH; i++) {\n    for (int j = 0; j < MAX_LENGTH; j++) {\n      if ((i == TRIGGER) && (j == TRIGGER1))\n        svp_simple_005_001_global_var = 0x01;\n    }\n  }\n\n  if (svp_simple_005_001_global_condition ==\n      1)\n    svp_simple_005_001_global_var = 0x09;\n\n  svp_simple_005_001_global_var = 0x05;\n}",
      "truncated": false
    },
    {
      "function": "svp_simple_005_001_isr_1",
      "file": "svp_simple_005/svp_simple_005_001.c",
      "line_start": 43,
      "line_end": 47,
      "code": "void svp_simple_005_001_isr_1() {\n  idlerun();\n  int reader;\n  reader = svp_simple_005_001_global_var;\n}",
      "truncated": false
    }
  ],
  "solver_result": {
    "verdict": "not_run",
    "engine": "z3"
  },
  "static_features": {
    "feeds_branch": false,
    "used_as_index": false,
    "call_path_depth_max": 1,
    "same_statement_a1_a2": false,
    "priority_gap": 1,
    "any_masking_present": false
  },
  "provenance": {
    "entries": [
      {
        "fact": "flows",
        "status": "assumed_from_config",
        "note": "entry points, interrupt numbers and priorities come from the suite README table, which also states the convention that a larger number is a higher priority"
      },
      {
        "fact": "solver_result",
        "status": "unknown",
        "note": "stage 3 has not run; this is a stage-2 record"
      },
      {
        "fact": "masking",
        "status": "proven",
        "note": "the subject contains no disable_isr call on any path"
      }
    ],
    "completeness": {
      "unresolved_indirect_calls": 0,
      "opaque_external_calls": [
        "init",
        "idlerun"
      ],
      "truncated_fields": []
    }
  },
  "emitted_by": {
    "tool_version": "0.1.0",
    "stage": "stage2",
    "run_id": "svp_simple_005_001-fixture",
    "timestamp": "2026-09-26T00:00:00Z"
  }
}
