{
  "schema_version": "c2/2.0.0",
  "id": "c868c421dea8fd180",
  "fingerprint": "868c421dea8fd180e6fd717f75cffa60fe33220072b3b3c8eba209373d49d89b",
  "class": "atomicity-triple",
  "pattern": "RWR",
  "subject": {
    "name": "svp_simple_017_001",
    "source_root": "C:\\Users\\luoma\\Desktop\\racebench\\2.1_remarks"
  },
  "variable": {
    "name": "svp_simple_017_001_global_var",
    "declared_type": "volatile int",
    "volatile": true,
    "decl": {
      "file": "svp_simple_017/svp_simple_017_001.c",
      "line": 22,
      "column": 0,
      "end_line": 22,
      "snippet": "volatile int svp_simple_017_001_global_var;"
    },
    "storage": "global",
    "aliases": [],
    "svf_node": null
  },
  "accesses": [
    {
      "role": "A1",
      "kind": "read",
      "flow": "main",
      "function": "svp_simple_017_001_main",
      "source": {
        "file": "svp_simple_017/svp_simple_017_001.c",
        "line": 29,
        "column": 2,
        "end_line": 29,
        "snippet": "for (svp_simple_017_001_global_var = 0; svp_simple_017_001_global_var < MAX_LENGTH;"
      },
      "loop_context": {
        "in_loop": false,
        "nest": []
      },
      "call_path": {
        "flow": "main",
        "frames": [
          {
            "function": "svp_simple_017_001_main"
          }
        ]
      },
      "masking": {
        "disabled": [],
        "enabled": [
          1
        ],
        "unknown": []
      }
    },
    {
      "role": "B",
      "kind": "write",
      "flow": "isr_1",
      "function": "svp_simple_017_001_isr_1",
      "source": {
        "file": "svp_simple_017/svp_simple_017_001.c",
        "line": 39,
        "column": 2,
        "end_line": 39,
        "snippet": "svp_simple_017_001_global_var = TRIGGER;"
      },
      "loop_context": {
        "in_loop": false,
        "nest": []
      },
      "call_path": {
        "flow": "isr_1",
        "frames": [
          {
            "function": "svp_simple_017_001_isr_1"
          }
        ]
      },
      "masking": {
        "disabled": [],
        "enabled": [
          1
        ],
        "unknown": []
      }
    },
    {
      "role": "A2",
      "kind": "read",
      "flow": "main",
      "function": "svp_simple_017_001_main",
      "source": {
        "file": "svp_simple_017/svp_simple_017_001.c",
        "line": 29,
        "column": 2,
        "end_line": 29,
        "snippet": "for (svp_simple_017_001_global_var = 0; svp_simple_017_001_global_var < MAX_LENGTH;"
      },
      "loop_context": {
        "in_loop": false,
        "nest": []
      },
      "call_path": {
        "flow": "main",
        "frames": [
          {
            "function": "svp_simple_017_001_main"
          }
        ]
      },
      "masking": {
        "disabled": [],
        "enabled": [
          1
        ],
        "unknown": []
      }
    }
  ],
  "flows": [
    {
      "id": "main",
      "kind": "task",
      "entry": "svp_simple_017_001_main",
      "irq": null,
      "priority": 0,
      "identified_by": "config"
    },
    {
      "id": "isr_1",
      "kind": "isr",
      "entry": "svp_simple_017_001_isr_1",
      "irq": 1,
      "priority": 1,
      "identified_by": "config"
    }
  ],
  "preemption": {
    "preempting_flow": "isr_1",
    "preempted_flow": "main",
    "priority_relation": "strictly-higher",
    "equal_priority_assumed_preemptible": null,
    "nesting_depth": 1,
    "timing": "unconstrained"
  },
  "masking": {
    "per_access": [
      {
        "role": "A1",
        "state": {
          "disabled": [],
          "enabled": [
            1
          ],
          "unknown": []
        }
      },
      {
        "role": "B",
        "state": {
          "disabled": [],
          "enabled": [
            1
          ],
          "unknown": []
        }
      },
      {
        "role": "A2",
        "state": {
          "disabled": [],
          "enabled": [
            1
          ],
          "unknown": []
        }
      }
    ],
    "interval": {
      "from_role": "A1",
      "to_role": "A2",
      "disabled_throughout": [],
      "enabled_somewhere": [
        1
      ],
      "unknown": [],
      "reenabled_within_interval_by": [],
      "critical_sections": []
    }
  },
  "call_paths": [
    {
      "role": "A1",
      "path": {
        "flow": "main",
        "frames": [
          {
            "function": "svp_simple_017_001_main"
          }
        ]
      }
    },
    {
      "role": "B",
      "path": {
        "flow": "isr_1",
        "frames": [
          {
            "function": "svp_simple_017_001_isr_1"
          }
        ]
      }
    },
    {
      "role": "A2",
      "path": {
        "flow": "main",
        "frames": [
          {
            "function": "svp_simple_017_001_main"
          }
        ]
      }
    }
  ],
  "loop_context": {
    "per_access": [
      {
        "role": "A1",
        "context": {
          "in_loop": false,
          "nest": []
        }
      },
      {
        "role": "B",
        "context": {
          "in_loop": false,
          "nest": []
        }
      },
      {
        "role": "A2",
        "context": {
          "in_loop": false,
          "nest": []
        }
      }
    ],
    "a1_a2_same_statement": true
  },
  "enclosing_source": [
    {
      "function": "svp_simple_017_001_main",
      "file": "svp_simple_017/svp_simple_017_001.c",
      "line_start": 25,
      "line_end": 34,
      "code": "void svp_simple_017_001_main() {\n  init();\n  int i = 0;\n\n  for (svp_simple_017_001_global_var = 0; svp_simple_017_001_global_var < MAX_LENGTH;\n       svp_simple_017_001_global_var++)\n  {\n    svp_simple_017_001_local_array[svp_simple_017_001_global_var] = i++;\n  }\n}",
      "truncated": false
    },
    {
      "function": "svp_simple_017_001_isr_1",
      "file": "svp_simple_017/svp_simple_017_001.c",
      "line_start": 36,
      "line_end": 42,
      "code": "void svp_simple_017_001_isr_1() {\n  idlerun();\n\n  svp_simple_017_001_global_var = TRIGGER;\n\n  svp_simple_017_001_local_array[TRIGGER] = 0;\n}",
      "truncated": false
    }
  ],
  "solver_result": {
    "verdict": "not_run",
    "engine": "z3"
  },
  "static_features": {
    "feeds_branch": true,
    "used_as_index": true,
    "call_path_depth_max": 1,
    "same_statement_a1_a2": true,
    "priority_gap": 1,
    "any_masking_present": false
  },
  "provenance": {
    "entries": [
      {
        "fact": "flows",
        "status": "assumed_from_config",
        "note": "entry points, interrupt numbers and priorities come from the suite README table, which also states the convention that a larger number is a higher priority"
      },
      {
        "fact": "solver_result",
        "status": "unknown",
        "note": "stage 3 has not run; this is a stage-2 record"
      },
      {
        "fact": "loop_context.a1_a2_same_statement",
        "status": "proven",
        "note": "the for header at line 29 runs MAX_LENGTH times, so its condition read occurs repeatedly and A1 and A2 are two distinct executions of one statement"
      }
    ],
    "completeness": {
      "unresolved_indirect_calls": 0,
      "opaque_external_calls": [
        "init",
        "idlerun"
      ],
      "truncated_fields": []
    }
  },
  "emitted_by": {
    "tool_version": "0.1.0",
    "stage": "stage2",
    "run_id": "svp_simple_017_001-fixture",
    "timestamp": "2026-09-26T00:00:00Z"
  }
}
